<?xml version="1.0" encoding="UTF-8"?>
{% load i18n %}
<body xmlns:xsi="http://www.w3.org/2001/XMLSchema-instance" xsi:noNamespaceSchemaLocation="../Hki-lisa_paatosXML_AA-2030/hkilisa-paatosteksti.xsd">
	<main id="paatoksenliite" lang="{{language}}">
		<h1>{{ _("Granting of Helsinki-lisä benefit") }}</h1>
		<table class="twocols-noborders">
			<tbody>
				<tr>
					<th scope="row">{{ _("Application number") }}</th>
					<td>{{ application.application_number }}</td>
				</tr>
				<tr>
					<th scope="row">{{ _("applicant") }}</th>
					<td>{{ application.company.name }}</td>
				</tr>
				<tr>
					<th scope="row">{{ _("Business ID") }}</th>
					<td>{{ application.company.business_id }}</td>
				</tr>
				<tr>
					<th scope="row">{{ _("Employee last name") }}</th>
					<td>{{ application.employee.last_name }}</td>
				</tr>
				<tr>
					<th scope="row">{{ _("Employee first name") }}</th>
					<td>{{ application.employee.first_name }}</td>
				</tr>
				<tr>
					<th scope="row">{{ _("Benefit type") }}</th>
					<td>{{ benefit_type }}</td>
				</tr>
			</tbody>
		</table>
		<table>
			<thead>
				<tr>
					<th>{{ _("Applying for dates") }}</th>
					<th>{{ _("Benefit per month") }}</th>
					<th>{{ _("Total benefit") }}€</th>
				</tr>
			</thead>
			<tbody>
			{% for row in calculation_rows %}
				<tr>
					<td>{{ row.start_date|date:"d.m.Y" }} - {{ row.end_date|date:"d.m.Y" }}</td>
					<td>{{ row.amount }}</td>
					<th>{{ application.calculation.calculated_benefit_amount }}</th>
				</tr>
			{% endfor %}
			</tbody>
		</table>
	</main>
</body>

